{
  "$schema": "http://json-schema.org/draft-07/schema#",
  "$id": "https://cubica.platform/games/cards-money-trains-mock/map-annotation.schema.json",
  "title": "Cards Money Trains map annotation",
  "description": "Контракт ручной аннотации транспортной сети поверх изображения. Изображение является входом для разметки, но не источником игровых правил.",
  "type": "object",
  "additionalProperties": false,
  "required": [
    "schemaVersion",
    "status",
    "sourceImage",
    "coordinateSystem",
    "nodes",
    "edges",
    "regions"
  ],
  "properties": {
    "$schema": { "type": "string" },
    "schemaVersion": { "const": "1.0" },
    "status": { "enum": ["template", "mock", "author-confirmed"] },
    "warning": {
      "type": "string",
      "minLength": 1,
      "description": "Явная маркировка происхождения и допустимого использования данных."
    },
    "sourceImage": {
      "type": "object",
      "additionalProperties": false,
      "required": ["file", "pixelWidth", "pixelHeight"],
      "properties": {
        "file": { "type": "string", "minLength": 1 },
        "pixelWidth": { "type": "integer", "minimum": 1 },
        "pixelHeight": { "type": "integer", "minimum": 1 },
        "sha256": { "type": "string", "pattern": "^[a-f0-9]{64}$" },
        "rightsConfirmed": { "type": "boolean" }
      }
    },
    "coordinateSystem": {
      "type": "object",
      "additionalProperties": false,
      "required": ["origin", "units", "width", "height"],
      "properties": {
        "origin": { "const": "top-left" },
        "units": { "const": "design-pixel" },
        "width": { "type": "integer", "minimum": 320, "maximum": 10000 },
        "height": { "type": "integer", "minimum": 320, "maximum": 10000 }
      }
    },
    "nodes": {
      "type": "array",
      "minItems": 2,
      "items": { "$ref": "#/definitions/node" }
    },
    "edges": {
      "type": "array",
      "minItems": 1,
      "items": { "$ref": "#/definitions/edge" }
    },
    "regions": {
      "type": "array",
      "minItems": 1,
      "items": { "$ref": "#/definitions/region" }
    }
  },
  "definitions": {
    "id": {
      "type": "string",
      "pattern": "^[a-z0-9][a-z0-9._:-]{0,127}$"
    },
    "point": {
      "type": "object",
      "additionalProperties": false,
      "required": ["x", "y"],
      "properties": {
        "x": { "type": "number", "minimum": 0 },
        "y": { "type": "number", "minimum": 0 }
      }
    },
    "node": {
      "type": "object",
      "additionalProperties": false,
      "required": ["id", "label", "kind", "position", "state"],
      "properties": {
        "id": { "$ref": "#/definitions/id" },
        "label": { "type": "string", "minLength": 1, "maxLength": 80 },
        "kind": { "enum": ["terminal", "waypoint"] },
        "position": { "$ref": "#/definitions/point" },
        "state": { "enum": ["open", "closed"] },
        "evidence": { "type": "string", "minLength": 1 }
      }
    },
    "edge": {
      "type": "object",
      "additionalProperties": false,
      "required": ["id", "fromNodeId", "toNodeId", "state"],
      "properties": {
        "id": { "$ref": "#/definitions/id" },
        "fromNodeId": { "$ref": "#/definitions/id" },
        "toNodeId": { "$ref": "#/definitions/id" },
        "state": { "enum": ["building", "open", "blocked"] },
        "evidence": { "type": "string", "minLength": 1 }
      }
    },
    "region": {
      "type": "object",
      "additionalProperties": false,
      "required": ["id", "label", "countryId", "polygon"],
      "properties": {
        "id": { "$ref": "#/definitions/id" },
        "label": { "type": "string", "minLength": 1, "maxLength": 80 },
        "countryId": { "$ref": "#/definitions/id" },
        "polygon": {
          "type": "array",
          "minItems": 4,
          "items": { "$ref": "#/definitions/point" },
          "description": "Замкнутый контур: последняя точка должна совпадать с первой."
        },
        "evidence": { "type": "string", "minLength": 1 }
      }
    }
  }
}
