{
  "$schema": "./map-annotation.schema.json",
  "schemaVersion": "1.0",
  "status": "template",
  "warning": "ШАБЛОН: заменить все примерные значения после ручной сверки с автором игры.",
  "sourceImage": {
    "file": "PATH/TO/SOURCE-IMAGE.png",
    "pixelWidth": 1400,
    "pixelHeight": 1000,
    "rightsConfirmed": true
  },
  "coordinateSystem": {
    "origin": "top-left",
    "units": "design-pixel",
    "width": 1400,
    "height": 1000
  },
  "nodes": [
    {
      "id": "replace-terminal-a",
      "label": "Заменить A",
      "kind": "terminal",
      "position": { "x": 200, "y": 200 },
      "state": "open",
      "evidence": "Подтвердить центр маркера на изображении."
    },
    {
      "id": "replace-terminal-b",
      "label": "Заменить B",
      "kind": "terminal",
      "position": { "x": 700, "y": 500 },
      "state": "open",
      "evidence": "Подтвердить центр маркера на изображении."
    }
  ],
  "edges": [
    {
      "id": "replace-edge-a-b",
      "fromNodeId": "replace-terminal-a",
      "toNodeId": "replace-terminal-b",
      "state": "open",
      "evidence": "Подтвердить логическую дорогу, а не только визуальную линию."
    }
  ],
  "regions": [
    {
      "id": "replace-region-a",
      "label": "Заменить область",
      "countryId": "replace-country",
      "polygon": [
        { "x": 50, "y": 50 },
        { "x": 1350, "y": 50 },
        { "x": 1350, "y": 950 },
        { "x": 50, "y": 950 },
        { "x": 50, "y": 50 }
      ],
      "evidence": "Обвести границу области и явно замкнуть контур."
    }
  ]
}
